{
  "source_commit": "fbdd1c48916e495be064372a4f7f24658dd0c2e2",
  "source_readme_sha256": "412d0974fd0646eb3d83d23fc670ccf306513cc4def544138c2bd03c132f40e3",
  "locale": "hi",
  "translation_status": "AI_SECOND_PASS_REVIEWED",
  "reviewers": [],
  "readme_path": "README.hi.md",
  "readme_sha256": "ad714e38adc558df06830434a1474f4d54ddd66ccd8c9feaffab2f561e677fad",
  "image_status": "LOCALIZED",
  "image_path": "docs/assets/i18n/hi/uriel-forge-hero.png",
  "image_sha256": "87a7772877b861a7eb8686ac6bb635e3f3d8f2dce9627090b1ada5f0ba5717d8",
  "image_art_path": "docs/assets/i18n/hi/uriel-forge-hero-art.png",
  "image_art_sha256": "fccb93eaf849684d8281284583ec05711ffe51d97ec4b0acb6d3afb6602d9ee4",
  "image_copy_path": "globalization/image_copy/hi.json",
  "image_copy_sha256": "d62e189a875f6c2a3faf219590eacca971246d2ee4ef829ae8e28450a7014eb9",
  "image_renderer_path": "scripts/render_localized_heroes.py",
  "image_renderer_sha256": "233315ad2e5e5f9013d6563622a03f2d483039bf1cfce4bd136f8041cef54ef3",
  "verified_at_utc": "2026-08-08T21:41:22Z",
  "schema": "uriel.translation_manifest.v1"
}
